{
  "$schema": "https://json-schema.org/draft/2020-12/schema",
  "$id": "https://matriya.example/schemas/scientific-task-contract/v1.0.json",
  "title": "MATRIYA Scientific Task Contract",
  "description": "STABLE v1.0. Where the Engine Contract says HOW an engine looks, the Task Contract says WHAT the user is trying to achieve. A user goal (intent) resolves to a task type and a capability graph expressed purely in Capability Ontology terms. GOVERNING RULE: a task NEVER names an engine — only capabilities. The Capability Planner matches the graph to engine capability vectors. Documentation only; no runtime behaviour. Hierarchy: User Goal -> Scientific Task -> Capability Planner -> Engine Contract -> Engine -> Result.",
  "type": "object",
  "additionalProperties": false,
  "required": ["apiVersion", "taskId", "name", "intent", "taskType", "subject", "capabilityGraph", "outputExpectation", "safety", "referencesEngines"],
  "properties": {
    "apiVersion": { "const": "scientific-task-contract/v1.0" },
    "taskId": { "type": "string" },
    "name": { "type": "string" },
    "intent": {
      "description": "The user goal in their own words — an intention, not an API call, e.g. 'reduce water absorption of the plaster'.",
      "type": "string",
      "minLength": 4
    },
    "taskType": {
      "enum": ["diagnosis", "comparison", "optimization", "ideation", "validation", "experiment_planning", "prediction", "selection", "explanation", "solution_discovery"]
    },
    "subject": {
      "type": "object",
      "additionalProperties": false,
      "required": ["type"],
      "properties": {
        "type": { "type": "string", "description": "material / mechanism / product / application / failure ..." },
        "ref": { "type": "string" }
      }
    },
    "valueWeights": {
      "description": "Optional goal weighting (the Value Field): e.g. { fire: 0.5, cost: 0.3, voc: 0.2 }. Shapes 'recommend'/'optimize'.",
      "type": "object",
      "additionalProperties": { "type": "number", "minimum": 0, "maximum": 1 }
    },
    "capabilityGraph": {
      "description": "The capabilities this task consumes, as a small DAG. Nodes reference Capability Ontology ids (primitive OR derived) — never engines.",
      "type": "object",
      "additionalProperties": false,
      "required": ["nodes", "edges"],
      "properties": {
        "nodes": {
          "type": "array",
          "minItems": 1,
          "items": {
            "type": "object",
            "additionalProperties": false,
            "required": ["id", "capability"],
            "properties": {
              "id": { "type": "string" },
              "capability": {
                "description": "A Capability Ontology id: 7 primitives + derived {compare, diagnose, optimize, prioritize}.",
                "enum": ["observe", "explain", "predict", "recommend", "generate", "validate", "learn", "compare", "diagnose", "optimize", "prioritize"]
              },
              "minStrength": { "type": "integer", "minimum": 0, "maximum": 5, "description": "Minimum engine self-rating required to satisfy this node." },
              "rationale": { "type": "string" }
            }
          }
        },
        "edges": {
          "type": "array",
          "items": {
            "type": "object",
            "additionalProperties": false,
            "required": ["from", "to"],
            "properties": {
              "from": { "type": "string" },
              "to": { "type": "string" },
              "dataflow": { "type": "string" }
            }
          }
        }
      }
    },
    "successCriteria": {
      "type": "array",
      "items": { "type": "string" }
    },
    "outputExpectation": {
      "description": "What a good result IS. Default 'scientific_narrative' — an explainable, provenance-bound answer, not raw data.",
      "enum": ["scientific_narrative", "ranked_candidates", "diagnosis_report", "comparison_matrix", "experiment_plan", "prediction_report"]
    },
    "safety": {
      "type": "object",
      "additionalProperties": false,
      "required": ["generatedOutputsAreHypotheses", "humanValidationRequiredForPromotion", "respectsDomainSeparation"],
      "properties": {
        "generatedOutputsAreHypotheses": { "type": "boolean" },
        "humanValidationRequiredForPromotion": { "type": "boolean" },
        "respectsDomainSeparation": { "type": "boolean" }
      }
    },
    "referencesEngines": {
      "description": "Structural assertion of the governing rule: a task declares it names NO engines. MUST be false.",
      "const": false
    }
  },
  "allOf": [
    {
      "$comment": "A task that requires generation (directly or via optimize) inherits the engine safety envelope: its generated outputs are hypotheses and promotion is human-gated.",
      "if": {
        "properties": {
          "capabilityGraph": {
            "properties": {
              "nodes": { "contains": { "properties": { "capability": { "enum": ["generate", "optimize"] } }, "required": ["capability"] } }
            }
          }
        },
        "required": ["capabilityGraph"]
      },
      "then": {
        "properties": {
          "safety": {
            "properties": {
              "generatedOutputsAreHypotheses": { "const": true },
              "humanValidationRequiredForPromotion": { "const": true }
            },
            "required": ["generatedOutputsAreHypotheses", "humanValidationRequiredForPromotion"]
          }
        }
      }
    }
  ]
}
